concept,criteria,summary,rep_examples,prevalence,n_matches,highlights
Dietary Restrictions,Does the text discuss pizza in the context of dietary restrictions or preferences?,"Dietary restrictions like vegetarianism, veganism, lactose intolerance, and celiac disease significantly altered my pizza experiences.","[""Getting diagnosed with celiac disease three years ago completely changed my pizza relationship.\nI used to be a pizza fiend - probably ate it 3-4 times a week in college.\nSuddenly I couldn't touch regular pizza without getting sick.\nThe first year was rough because gluten-free pizza was mostly terrible.\nDenver's food scene has really stepped up with dedicated gluten-free places like Blackjack and Pizza Republica.\nNow I actually enjoy pizza again, though it's more expensive and I have to plan ahead.\nGood gluten-free crust is everything - it should actually taste like pizza, not cardboard.\nI like cauliflower or almond flour crusts that have some structure and flavor.\nThe sauce and cheese become more important when the crust is different, so I want really good tomato sauce and fresh mozzarella.\nMy go-to is margherita or pepperoni with hot honey.\nPizza requires more planning now.\nI can't just grab a random slice anymore - I need to research places, call ahead, or go to dedicated gluten-free spots.\nIt's usually weekend social food when I can coordinate with friends who are understanding about dietary restrictions.\nI do more pizza at home now using GF crusts from Whole Foods.\nI'm very focused on avoiding cross-contamination, so I prefer places that use separate prep areas and clean boxes.\nSome regular pizzerias aren't careful about using the same surfaces.\nI still eat with my hands - gluten-free pizza might be different but the eating experience should stay the same.\nGood GF crust holds up just fine without utensils.\nThe biggest barriers are cost and availability."", ""Developing lactose intolerance in my late twenties really changed my whole pizza relationship.\nI used to be a total cheese lover - extra cheese, multiple cheese types, the works.\nSuddenly I couldn't eat regular pizza without feeling terrible for hours afterward.\nPhoenix has been getting better with dairy-free options, but it took a while to find places that do good vegan cheese that actually melts and tastes decent.\nNow I'm more conscious about ingredients and appreciate places that take dietary restrictions seriously rather than just throwing some sad dairy-free cheese on dough and calling it pizza.\nGood dairy-free cheese is absolutely essential - it needs to melt properly and not taste like cardboard.\nI like cashew-based or the newer oat milk cheeses.\nThin to medium crust, good tomato sauce with herbs, lots of vegetables since I can't rely on cheese for flavor anymore.\nThe sauce becomes more important when you can't load up on cheese.\nPizza requires more planning now since not every place has good dairy-free options.\nI usually research restaurants beforehand or stick to places I know handle it well.\nIt's still social food for me, but I have to coordinate with friends about where we're going.\nSometimes I'll eat beforehand if I know the pizza options will be limited.\nI pay attention to places that use separate prep areas to avoid cross-contamination.\nSome regular pizzerias aren't careful about using the same surfaces or utensils.\nI still eat with my hands - lactose intolerance doesn't change how you eat pizza, just what kind you can have.\nGood dairy-free pizza should be eaten the same way as regular pizza.\nDairy-free pizza almost always costs more - usually $3-5 extra for vegan cheese, which adds up.\nNot every place offers it, and when they do, the quality varies wildly.""]",0.12,6,"['Developing lactose intolerance in my late twenties really changed my whole pizza relationship.', 'Lactose intolerance is my main barrier now.', ""When I went vegan for ethical reasons, I thought I'd have to give up pizza entirely.""]"
Pizza Evolution,Does the text describe a change or evolution in pizza preferences or availability over time?,"My relationship with pizza has evolved through experiences, regional influences, dietary changes, and a growing appreciation for craft.","[""I've been eating pizza in Philly since the 1960s when it was mainly Italian neighborhoods making it.\nBack then, pizza was simpler - tomato pie from Villa di Roma or basic slices from corner spots.\nI wouldn't say my taste changed dramatically, but I've watched the city's pizza scene evolve.\nNow there's all these fancy places with $25 pies, which seems crazy to me.\nI still prefer the old-school spots that have been around forever.\nPizza used to be cheap food for working people, now it's gotten all gourmet.\nI like traditional tomato pie - thick Sicilian crust, sweet sauce, light cheese or sometimes no cheese at all.\nThe crust should be substantial and slightly sweet, sauce should be the star with good tomato flavor.\nWhen I do want cheese pizza, just regular mozzarella, nothing fancy.\nI don't need all these exotic toppings or multiple cheese blends.\nPizza is an occasional treat, maybe once or twice a month.\nSometimes I'll grab a slice when I'm in South Philly visiting the old neighborhood.\nIf my son visits with the grandkids, we might order pizza for dinner.\nIt's become less frequent as I've gotten older - doesn't sit as well as it used to.\nWhen I do eat it, I prefer sitting down at the actual pizzeria rather than delivery.\nI remember when pizza came wrapped in paper, not boxes.\nBoxes are fine but seem wasteful for just a slice or two.\nI always eat pizza with my hands - that's how I learned and how it should be done.\nThe main barrier now is that many of my old favorite places have closed or changed ownership.\nThe neighborhood spots that made real tomato pie are disappearing."", ""the pizza scene here has improved dramatically in that time.\nit was mostly chains and a few mediocre local places.\nNow Charlotte has some really solid spots like Hawkers Asian Street Food doing interesting fusion pizzas.\nplaces like Inizio doing legit Neapolitan style.\nThe city's growth brought better restaurants, including pizza.\nI've watched my neighborhood transform from chain restaurants to having actual food culture.\nI like a medium-thickness crust with good structure - not too thin but not Chicago thick either.\nBalanced sauce and cheese, maybe 55-45 cheese to sauce.\nI'm a meat person - pepperoni, sausage, sometimes bacon.\nThe crust should have some char but not be burnt.\nCharlotte doesn't really have a signature style, so I appreciate places that do classic approaches well.\nI want pizza that tastes like pizza, not some deconstructed art project.\nSolid, reliable, tasty food without pretension.\nPizza is casual weekend food for my family.\nMaybe twice a month we'll order for dinner when nobody wants to cook.\nIt's easy family food that everyone can agree on.\nPizza represents relaxed family time without formal dining.\nI eat with my hands like a normal person - using utensils for pizza seems unnecessarily formal.\nCost can be a factor with teenagers who eat large quantities - feeding a family with good pizza can hit $40-50.\nSome places are great, others are just okay, and it takes trial and error to figure out what's worth your money.""]",0.76,38,"['Developing lactose intolerance in my late twenties really changed my whole pizza relationship.', 'Being vegetarian actually expanded my pizza horizons rather than limiting them.', 'I took it for granted, but living in other states made me realize how unique and special Connecticut pizza culture is.']"
Pizza Ingredient Quality,Does the text emphasize the importance of quality ingredients in pizza?,"Quality ingredients, like fresh cheese and flavorful sauce, are essential for a great pizza experience.","[""My big pizza moment was trying Regina's in the North End during college.\nI grew up on Pizza Hut and thought that was normal pizza.\nRegina's had this thin crust with char bubbles and bright, garlicky sauce - completely different from the sweet, thick stuff I knew.\nIt opened my eyes to what pizza could be.\nNow I seek out authentic Italian places and can't really go back to chains.\nLiving in Boston spoiled me with great options like Santarpio's.\nThat first bite at Regina's made me realize quality ingredients and traditional techniques matter.\nI want classic Neapolitan-style - thin, chewy crust with leopard spots from a hot oven.\nSan Marzano tomato sauce, crushed by hand, with just garlic and basil.\nFresh mozzarella di bufala, not processed cheese.\nAbout 60-40 cheese to sauce ratio.\nThe crust should be airy with good char but still foldable.\nA drizzle of olive oil and fresh basil on top.\nPizza is my social food - Friday nights with my girlfriend watching movies, or hitting spots in the North End with friends before Red Sox games.\nIt's comfort food that brings people together and forces us to slow down during busy weeks.\nPizza represents relaxation and celebration in my life.\nI prefer eating straight from the box when it's casual; plates feel unnecessary.\nAs for utensils, absolutely not. That's sacrilege.\nThe biggest barrier is quality, not availability."", ""pizza was just background noise - it was everywhere and I took it for granted.\nholy shit, their pizza was terrible.\nIt made me realize how spoiled I was having real New York pizza on every corner.\nI had this renewed appreciation for what I grew up with.\nI'm kind of a pizza snob about it.\nI judge cities by their pizza quality and most places don't measure up to what's normal here.\nClassic New York slice - thin crust with good char and chew, tangy sauce that's not sweet, low-moisture mozzarella that gets those perfect brown spots.\nThe fold test is essential - it should bend but not break.\nProper grease pools that you dab with a napkin.\nSize matters too - a real slice should be huge and cost around $3.\nI like plain cheese most of the time, maybe pepperoni if I'm feeling fancy.\nPlaces like Joe's or Prince Street Pizza represent the gold standard.\nIt's about simplicity and perfect execution.\nPizza is daily life in NYC.\nI probably eat pizza 4-5 times a week just because it's convenient and good.\nPizza fits the pace of city life perfectly.\nReal NYC pizza comes on paper plates or you eat it standing up.\nThe fold technique is crucial for structural integrity and preventing burns.\nEating pizza with a fork is like drinking wine from a beer bottle.\nThe abundance of options can actually be overwhelming - decision paralysis when you have 15 pizza places within three blocks.""]",0.76,38,"['Good dairy-free cheese is absolutely essential - it needs to melt properly and not taste like cardboard.', 'I prefer thin crust now - easier to digest and not as filling.', 'I learned to appreciate how pizza adapts to regional tastes and ingredients.']"
Pizza as Social Food,Does the text mention pizza being used in social settings or gatherings?,"Pizza is our go-to social food for family gatherings, casual dinners, and fun outings with friends.","[""My relationship with pizza has gone through phases.\nGrowing up in Brooklyn in the '60s, pizza was everywhere and cheap - 15 cents a slice at Joe's after school.\nWhen I moved to Miami in the '80s, I was disappointed by the pizza scene.\nEverything was too thick and sweet.\nI stopped eating it regularly for about a decade.\nThen my grandchildren started visiting and I rediscovered pizza through their eyes.\nNow I appreciate it as an occasional treat rather than regular food.\nMy tastes became simpler - plain cheese, maybe mushrooms.\nAt my age, I keep it simple.\nClassic New York style - thin crust that's crispy but has chew.\nNot too much sauce, and it shouldn't be sweet like some Florida places make it.\nJust good tomatoes, garlic, oregano.\nFresh mozzarella, not too thick.\nPizza is mostly about family time now.\nWhen grandchildren visit, we get pizza at least once - one of the few foods three generations agree on.\nI rarely eat pizza alone - feels like social food for sharing.\nPizza nights with family are about conversation and connection, not just food.\nI'm firmly hands-only though - using utensils seems odd and pretentious.\nEating with hands connects you to food more directly.\nSometimes nostalgia is the biggest barrier."", ""Going vegan sophomore year of high school completely changed my pizza world.\nI used to be obsessed with pepperoni and extra cheese - total basic pizza girl.\nWhen I went vegan for ethical reasons, I thought I'd have to give up pizza entirely.\nLA's vegan scene is incredible, especially for someone my age who cares about animal rights and climate change.\nPlaces like Cruzer Pizza and Double Zero do amazing vegan cheese that actually melts and tastes good.\nIt forced me to appreciate vegetables as toppings and try combinations I never would have considered before.\nNow I honestly prefer vegan pizza.\nGood vegan cheese is essential - it needs to melt properly and have that stretchy, satisfying texture.\nI love cashew-based mozzarella or the newer oat-based cheeses.\nThin to medium crust, bright tomato sauce, and lots of vegetables - roasted red peppers, arugula, caramelized onions, mushrooms.\nMaybe some vegan sausage or pepperoni for protein.\nLA does amazing California-style pizza with fresh, local vegetables and creative combinations.\nThe crust should be a little charred and chewy.\nI want pizza that's satisfying but also makes me feel good about what I'm eating.\nPizza is social media food and friend hangouts.\nIt's also late-night food after concerts or parties - places like Cruzer stay open late for the younger crowd.\nPizza represents fun, social experiences and ethical eating choices.\nI love when places present vegan pizza beautifully - it helps normalize plant-based eating and shows it's not about deprivation.\nVegan pizza is more expensive, which is tough on a student budget.""]",0.94,47,"['Pizza night is sacred family time where we put phones away.', 'Pizza brings our friend group together - we have ongoing debates about best spots around campus.', ""Pizza happens maybe once every couple months, usually for kids' birthday parties or when we're having a group over and need something easy.""]"
Regional Pizza Preferences,Does the text describe specific regional preferences or styles of pizza?,"Regional pizza preferences reflect local cultures, ingredients, and traditions, showcasing diverse styles across the country.","[""My big pizza moment was trying Regina's in the North End during college.\nI grew up on Pizza Hut and thought that was normal pizza.\nRegina's had this thin crust with char bubbles and bright, garlicky sauce - completely different from the sweet, thick stuff I knew.\nIt opened my eyes to what pizza could be.\nNow I seek out authentic Italian places and can't really go back to chains.\nLiving in Boston spoiled me with great options like Santarpio's.\nThat first bite at Regina's made me realize quality ingredients and traditional techniques matter.\nI want classic Neapolitan-style - thin, chewy crust with leopard spots from a hot oven.\nSan Marzano tomato sauce, crushed by hand, with just garlic and basil.\nFresh mozzarella di bufala, not processed cheese.\nAbout 60-40 cheese to sauce ratio.\nThe crust should be airy with good char but still foldable.\nA drizzle of olive oil and fresh basil on top.\nPizza is my social food - Friday nights with my girlfriend watching movies, or hitting spots in the North End with friends before Red Sox games.\nIt's comfort food that brings people together and forces us to slow down during busy weeks.\nPizza represents relaxation and celebration in my life.\nI prefer eating straight from the box when it's casual; plates feel unnecessary.\nAs for utensils, absolutely not. That's sacrilege.\nThe biggest barrier is quality, not availability."", ""Detroit pizza isn't just food, it's cultural identity.\nI grew up on Buddy's and Loui's, thinking that square pizza with crispy cheese edges was normal.\nThen I left for college and discovered the rest of the world calls that 'Sicilian' and acts like New York thin crust is the only real pizza.\nIt made me defensive about our style and proud of what makes Detroit unique.\nThe steel pans, the Wisconsin brick cheese, the sauce on top - it's perfect and I'll fight anyone who says otherwise.\nAuthentic Detroit square - thick, airy crust that's crispy on the bottom from those blue steel pans.\nWisconsin brick cheese that caramelizes and gets crispy edges called 'frico.'\nThe crispy cheese edges are absolutely essential - that's what separates Detroit pizza from regular thick crust.\nPizza is Lions game food, family gatherings, and weekend comfort.\nDuring football season, Buddy's delivery is basically mandatory for watching games.\nIt's also celebration food - promotions, birthdays, good news gets celebrated with Detroit square pizza.\nI probably eat it twice a week, sometimes more during football season.\nIt's social food that brings people together and represents Detroit pride.\nSunday dinner with extended family often includes picking up squares from our favorite spots.\nThe presentation is part of the experience - seeing those perfect squares with caramelized edges.\nI eat it with my hands mostly, though sometimes you need a fork for the really cheesy bites.\nThe biggest barrier is that most places outside Detroit don't make real Detroit-style pizza, even when they claim to.\nThe pans, the cheese, the technique - it all matters.\nCost can be a factor since good Detroit pizza is substantial and priced accordingly.\nDuring economic downturns in the city, some longtime places have struggled or closed, which breaks my heart.""]",0.88,44,"['This city has everything - New York transplants making authentic thin crust, Chicago spots doing deep dish, California-style places with fancy toppings.', 'I like Kansas City-style barbecue pizza - thick crust that can handle substantial toppings, tangy barbecue sauce instead of tomato sauce, mozzarella and cheddar blend, burnt ends or pulled pork, red onions, maybe some pickled jalapeños.', ""Houston's food scene taught me that pizza is this amazing canvas for different cultures.""]"
